name,desc,image,PartyName,memberType,province_name,zone_number
เอกอรุณ มีวรรณ,ส.ส. เขต (ตราด เขต 1),http://202.6.26.16/images/candidate/thumb/23/1/5815369f-48aa-47a2-8ba0-cd878af0a55e.jpg,ทางเลือกใหม่,zone,ตราด,1
อำนาจ แสงสกาย,ส.ส. เขต (แม่ฮ่องสอน เขต 1),http://202.6.26.16/images/candidate/thumb/58/1/9020749b-fd56-4513-9c7d-3bddf614027c.jpg,ทางเลือกใหม่,zone,แม่ฮ่องสอน,1
ลำเจียก วงษ์ไทย,ส.ส. เขต (สมุทรสงคราม เขต 1),http://202.6.26.16/images/candidate/thumb/75/1/b9033983-b9e0-4008-9ccb-9f20af62c525.jpg,ทางเลือกใหม่,zone,สมุทรสงคราม,1
ณรงค์ มาตย์โอสถ,ส.ส. เขต (กระบี่ เขต 2),http://202.6.26.16/images/candidate/thumb/81/2/6568799b-5fab-41b8-a5ee-45c7f719a3e4.jpg,ทางเลือกใหม่,zone,กระบี่,2
อาทร ออมทรัพย์,ส.ส. เขต (ภูเก็ต เขต 1),http://202.6.26.16/images/candidate/thumb/83/1/99717edf-3285-49b0-b56f-f881525cf308.jpg,ทางเลือกใหม่,zone,ภูเก็ต,1
อนุชิต อัลมันศูรีย์,ส.ส. เขต (ภูเก็ต เขต 2),http://202.6.26.16/images/candidate/thumb/83/2/b78ee4b6-7f44-4652-a7e8-57cad44b95bb.jpg,ทางเลือกใหม่,zone,ภูเก็ต,2
ขาน เชื้อคำฮด,ส.ส. เขต (มุกดาหาร เขต 2),http://202.6.26.16/images/candidate/thumb/49/2/d59714f1-50b8-4235-855b-69fe1d479a18.jpg,ทางเลือกใหม่,zone,มุกดาหาร,2
ประพันธ์ บุญมี,ส.ส. เขต (จันทบุรี เขต 2),http://202.6.26.16/images/candidate/thumb/22/2/49fbcb5d-d53c-447d-a20c-10c6068691c6.jpg,ทางเลือกใหม่,zone,จันทบุรี,2
สมยศ มาเพิ่มผล,ส.ส. เขต (จันทบุรี เขต 3),http://202.6.26.16/images/candidate/thumb/22/3/c00904e1-1ed2-4a3e-96fc-3052b0aa95db.jpg,ทางเลือกใหม่,zone,จันทบุรี,3
เกษมสันต์ วงศ์สุวัฒน์,ส.ส. เขต (ชุมพร เขต 1),http://202.6.26.16/images/candidate/thumb/86/1/c6de2d6a-2bc8-40c5-ac53-1faf40854a29.jpg,ทางเลือกใหม่,zone,ชุมพร,1
ธนภัทร ประสิทธิ์,ส.ส. เขต (ชุมพร เขต 2),http://202.6.26.16/images/candidate/thumb/86/2/0ff8378d-f107-4a8f-a51e-61d7d2558d72.jpg,ทางเลือกใหม่,zone,ชุมพร,2
ปฐมพัทธ์ วงศ์สุวัฒน์,ส.ส. เขต (ชุมพร เขต 3),http://202.6.26.16/images/candidate/thumb/86/3/7cd009c8-0995-4fd8-870d-7322df7a98fa.jpg,ทางเลือกใหม่,zone,ชุมพร,3
ปรีดิ์ปราโมทย์ เลิศวรภัทร,ส.ส. เขต (ตรัง เขต 1),http://202.6.26.16/images/candidate/thumb/92/1/aadfbb94-11e4-452f-9030-d54a2c8029c7.jpg,ทางเลือกใหม่,zone,ตรัง,1
สันติ รักเพ็ชร,ส.ส. เขต (ตรัง เขต 2),http://202.6.26.16/images/candidate/thumb/92/2/c3e2185e-2eac-45bc-aedd-0b1e415b35a1.jpg,ทางเลือกใหม่,zone,ตรัง,2
วิชิต กุลจิ,ส.ส. เขต (ตรัง เขต 3),http://202.6.26.16/images/candidate/thumb/92/3/13d09f1c-807c-4c61-b0ec-41e362ab6f99.jpg,ทางเลือกใหม่,zone,ตรัง,3
นิพนธ์ อินต๊ะสอน,ส.ส. เขต (น่าน เขต 1),http://202.6.26.16/images/candidate/thumb/55/1/d6bfa4bb-cd0b-4c7f-8cdc-2e128d4a4f75.jpg,ทางเลือกใหม่,zone,น่าน,1
กัญญาณัฐ์ บุญธรรม,ส.ส. เขต (ปราจีนบุรี เขต 1),http://202.6.26.16/images/candidate/thumb/25/1/40e25b55-bdc6-4689-ab91-cb6e496173b0.jpg,ทางเลือกใหม่,zone,ปราจีนบุรี,1
เพชร์นภา แซ่ลิ้ม,ส.ส. เขต (ปราจีนบุรี เขต 2),http://202.6.26.16/images/candidate/thumb/25/2/1cdad3fb-e995-4278-b7ba-ca8fbab2c234.jpg,ทางเลือกใหม่,zone,ปราจีนบุรี,2
บึง อาสินรัมย์,ส.ส. เขต (ปราจีนบุรี เขต 3),http://202.6.26.16/images/candidate/thumb/25/3/e8387d48-76b1-4850-8c4a-a2d8f6d08f32.jpg,ทางเลือกใหม่,zone,ปราจีนบุรี,3
สุพัฒน์ ยาชะรัด,ส.ส. เขต (พัทลุง เขต 3),http://202.6.26.16/images/candidate/thumb/93/3/6e8668e8-a920-4945-9f39-4630383a7a26.jpg,ทางเลือกใหม่,zone,พัทลุง,3
นิชุติมา บัวเดช,ส.ส. เขต (ยะลา เขต 1),http://202.6.26.16/images/candidate/thumb/95/1/4ac4af2b-a63e-408d-a78a-a41e98a339ce.jpg,ทางเลือกใหม่,zone,ยะลา,1
กุลนิตย์ นิลเกตุ,ส.ส. เขต (หนองคาย เขต 2),http://202.6.26.16/images/candidate/thumb/43/2/0ab1f665-9d72-4ca2-a9bb-23f5f13f606c.jpg,ทางเลือกใหม่,zone,หนองคาย,2
ตึ๋ง เนาวะเพชร,ส.ส. เขต (หนองคาย เขต 3),http://202.6.26.16/images/candidate/thumb/43/3/c6918523-6e94-4f3c-82e3-378b16c01e66.jpg,ทางเลือกใหม่,zone,หนองคาย,3
ภิญโญ เนียมสงค์,ส.ส. เขต (ฉะเชิงเทรา เขต 3),http://202.6.26.16/images/candidate/thumb/24/3/e56918a4-ea8c-4457-8847-2f89d134b3bc.jpg,ทางเลือกใหม่,zone,ฉะเชิงเทรา,3
เพ็ญทิพย์ เรียบร้อย,ส.ส. เขต (นราธิวาส เขต 1),http://202.6.26.16/images/candidate/thumb/96/1/ca940277-7b63-4b7e-8e76-00f64c6f426c.jpg,ทางเลือกใหม่,zone,นราธิวาส,1
ฮัมดัม เจะโวะ,ส.ส. เขต (นราธิวาส เขต 2),http://202.6.26.16/images/candidate/thumb/96/2/ec753ef8-d014-40e9-a781-e33a1c17ea98.jpg,ทางเลือกใหม่,zone,นราธิวาส,2
มาลีดา มะทา,ส.ส. เขต (นราธิวาส เขต 3),http://202.6.26.16/images/candidate/thumb/96/3/2d832e2d-3d2a-49ca-aab7-45971ec50c88.jpg,ทางเลือกใหม่,zone,นราธิวาส,3
หะมุ ลาซิ,ส.ส. เขต (นราธิวาส เขต 4),http://202.6.26.16/images/candidate/thumb/96/4/0cb208ba-6970-4f75-ba2b-e0a03bf22636.jpg,ทางเลือกใหม่,zone,นราธิวาส,4
ตอเละ ยุโซ๊ะ,ส.ส. เขต (ปัตตานี เขต 3),http://202.6.26.16/images/candidate/thumb/94/3/613c50f3-e5be-43c1-9d32-c5414d9063cb.jpg,ทางเลือกใหม่,zone,ปัตตานี,3
สมศักดิ์ สาระชาติ,ส.ส. เขต (พระนครศรีอยุธยา เขต 2),http://202.6.26.16/images/candidate/thumb/14/2/b924f42b-82c1-461b-91ad-7eb9767d2e70.jpg,ทางเลือกใหม่,zone,พระนครศรีอยุธยา,2
พัชรินทร์ สมบูรณ์,ส.ส. เขต (พระนครศรีอยุธยา เขต 4),http://202.6.26.16/images/candidate/thumb/14/4/2ad15150-3a89-4311-8951-3af39e1466fb.jpg,ทางเลือกใหม่,zone,พระนครศรีอยุธยา,4
เลิศไพฑูรณ์ ท่าทราย,ส.ส. เขต (นครปฐม เขต 3),http://202.6.26.16/images/candidate/thumb/73/3/60ebbc37-b6cd-492d-9829-657cd4993bb1.jpg,ทางเลือกใหม่,zone,นครปฐม,3
อภิฤหาญพามน ฉัตรอภิเที่ยงค่ำ,ส.ส. เขต (พิษณุโลก เขต 5),http://202.6.26.16/images/candidate/thumb/65/5/a4fdb413-5304-43da-b9a8-349bf25f9126.jpg,ทางเลือกใหม่,zone,พิษณุโลก,5
สนอง คำเพราะ,ส.ส. เขต (เพชรบูรณ์ เขต 1),http://202.6.26.16/images/candidate/thumb/67/1/b99c90f6-5db2-4271-8afe-2e6cfab8dfa6.jpg,ทางเลือกใหม่,zone,เพชรบูรณ์,1
กิตติศักดิ์ กองคำ,ส.ส. เขต (เพชรบูรณ์ เขต 2),http://202.6.26.16/images/candidate/thumb/67/2/bdd47d10-87be-4fc3-9c85-a8d95641828a.jpg,ทางเลือกใหม่,zone,เพชรบูรณ์,2
นะรินวัลย์ คล้ายเดชนิลินัน,ส.ส. เขต (เพชรบูรณ์ เขต 4),http://202.6.26.16/images/candidate/thumb/67/4/e20189d8-170a-4c54-9798-bf9a68c02e92.jpg,ทางเลือกใหม่,zone,เพชรบูรณ์,4
ศุภัทรดิศ มัชฌิมา,ส.ส. เขต (มหาสารคาม เขต 2),http://202.6.26.16/images/candidate/thumb/44/2/018d99fe-f453-438c-95c8-c87afe05b942.jpg,ทางเลือกใหม่,zone,มหาสารคาม,2
ประสงค์ กันหาป้อง,ส.ส. เขต (มหาสารคาม เขต 3),http://202.6.26.16/images/candidate/thumb/44/3/34807735-f578-422a-9059-e9829f9b33ab.jpg,ทางเลือกใหม่,zone,มหาสารคาม,3
ณิชาภา โคตรมั่นคง,ส.ส. เขต (มหาสารคาม เขต 4),http://202.6.26.16/images/candidate/thumb/44/4/0d38fd95-3c87-43c4-be51-438ec702a1e1.jpg,ทางเลือกใหม่,zone,มหาสารคาม,4
สุเทพ จันทะเหลา,ส.ส. เขต (มหาสารคาม เขต 5),http://202.6.26.16/images/candidate/thumb/44/5/484ff494-8850-4a59-bd45-32762dd7f495.jpg,ทางเลือกใหม่,zone,มหาสารคาม,5
ชาญสิทธิ์ คำเทศ,ส.ส. เขต (ราชบุรี เขต 3),http://202.6.26.16/images/candidate/thumb/70/3/8b7abe7e-a6fb-486a-b333-f96b71d7cbb2.jpg,ทางเลือกใหม่,zone,ราชบุรี,3
อุทาม ตาปราบ,ส.ส. เขต (ชัยภูมิ เขต 1),http://202.6.26.16/images/candidate/thumb/36/1/a928bfe2-8866-4028-8973-ab24ab7be737.jpg,ทางเลือกใหม่,zone,ชัยภูมิ,1
นฤชา แก้วสิงห์,ส.ส. เขต (ชัยภูมิ เขต 2),http://202.6.26.16/images/candidate/thumb/36/2/1442de6e-723d-4cfd-8a9e-35da02d7930d.jpg,ทางเลือกใหม่,zone,ชัยภูมิ,2
สันติภาพ จันทร์โท,ส.ส. เขต (ชัยภูมิ เขต 3),http://202.6.26.16/images/candidate/thumb/36/3/5924d090-73c1-452c-8fb6-61abd51c3414.jpg,ทางเลือกใหม่,zone,ชัยภูมิ,3
วิชิต วรสิงห์,ส.ส. เขต (ชัยภูมิ เขต 4),http://202.6.26.16/images/candidate/thumb/36/4/08d24c6f-ce21-4b2b-994a-e405e6c24cb5.jpg,ทางเลือกใหม่,zone,ชัยภูมิ,4
ประเสริฐ บุญโยธา,ส.ส. เขต (ชัยภูมิ เขต 5),http://202.6.26.16/images/candidate/thumb/36/5/8742574a-7c90-4565-a43b-51634a17af56.jpg,ทางเลือกใหม่,zone,ชัยภูมิ,5
ณรงฤทธิ์ มอบสันเทียะ,ส.ส. เขต (ชัยภูมิ เขต 6),http://202.6.26.16/images/candidate/thumb/36/6/6852526c-324b-47b8-88b4-e7f7f42f1e5b.jpg,ทางเลือกใหม่,zone,ชัยภูมิ,6
อนุชิต แก้วต้น,ส.ส. เขต (นครสวรรค์ เขต 5),http://202.6.26.16/images/candidate/thumb/60/5/de893936-14d8-4c9f-b612-4aa351c3a29b.jpg,ทางเลือกใหม่,zone,นครสวรรค์,5
ชมน์ธนาฒย์ ชาติศิริทรัพย์,ส.ส. เขต (นนทบุรี เขต 1),http://202.6.26.16/images/candidate/thumb/12/1/f51568b6-e739-4c28-baf5-6b8d81e52130.jpg,ทางเลือกใหม่,zone,นนทบุรี,1
สมชาย ศรีเย็น,ส.ส. เขต (นนทบุรี เขต 2),http://202.6.26.16/images/candidate/thumb/12/2/fa737188-7023-4d6c-ac09-dbc143417e42.jpg,ทางเลือกใหม่,zone,นนทบุรี,2
เกริกหิรัญ แปลกประเสริฐ,ส.ส. เขต (นนทบุรี เขต 3),http://202.6.26.16/images/candidate/thumb/12/3/30b2c930-10a2-421b-b7e4-1d5c5631d86d.jpg,ทางเลือกใหม่,zone,นนทบุรี,3
ประดิษฐ์ แน่วแน่,ส.ส. เขต (นนทบุรี เขต 4),http://202.6.26.16/images/candidate/thumb/12/4/6fd2bce1-6736-4672-b4e8-42c8a35d5ee7.jpg,ทางเลือกใหม่,zone,นนทบุรี,4
อัศนินท์ พิศาลอัครภัทร์,ส.ส. เขต (นนทบุรี เขต 5),http://202.6.26.16/images/candidate/thumb/12/5/84f12b2f-8667-4e55-a1f2-af585b37a10b.jpg,ทางเลือกใหม่,zone,นนทบุรี,5
สุนทร บัวกลิ่น,ส.ส. เขต (นนทบุรี เขต 6),http://202.6.26.16/images/candidate/thumb/12/6/ac4376f6-8c8c-41e9-b0d8-0a501c864520.jpg,ทางเลือกใหม่,zone,นนทบุรี,6
พลอยณิศา ชูศรี,ส.ส. เขต (สุราษฎร์ธานี เขต 1),http://202.6.26.16/images/candidate/thumb/84/1/1dc46170-c545-4a4f-aeb7-337225d96756.jpg,ทางเลือกใหม่,zone,สุราษฎร์ธานี,1
คฑาเทพ ธรรมเสน,ส.ส. เขต (สุราษฎร์ธานี เขต 2),http://202.6.26.16/images/candidate/thumb/84/2/2cfd75ec-0200-4c93-8869-ce191d66b779.jpg,ทางเลือกใหม่,zone,สุราษฎร์ธานี,2
ทรงยศ ศักดิ์เพชร,ส.ส. เขต (สุราษฎร์ธานี เขต 5),http://202.6.26.16/images/candidate/thumb/84/5/41622b57-d530-47ee-8ebb-93eefb1a4eed.jpg,ทางเลือกใหม่,zone,สุราษฎร์ธานี,5
ทักษิณา ศักดา,ส.ส. เขต (สุราษฎร์ธานี เขต 6),http://202.6.26.16/images/candidate/thumb/84/6/8d7849ed-1b2c-490e-abba-46c5f9d00ddf.jpg,ทางเลือกใหม่,zone,สุราษฎร์ธานี,6
สินีนาฎ วารีรัตน์,ส.ส. เขต (ร้อยเอ็ด เขต 3),http://202.6.26.16/images/candidate/thumb/45/3/8dbbcc9e-ca92-4620-9b40-ccc97ea07e59.jpg,ทางเลือกใหม่,zone,ร้อยเอ็ด,3
เชียง โคตุเคน,ส.ส. เขต (ร้อยเอ็ด เขต 4),http://202.6.26.16/images/candidate/thumb/45/4/5b7a4bf2-9047-475d-b6c7-81d13a2d973f.jpg,ทางเลือกใหม่,zone,ร้อยเอ็ด,4
ฐณณ พิหูสูตร,ส.ส. เขต (ร้อยเอ็ด เขต 5),http://202.6.26.16/images/candidate/thumb/45/5/7441436b-0df5-41f6-9e98-f84aa0fc934a.jpg,ทางเลือกใหม่,zone,ร้อยเอ็ด,5
ศิรินญา คำอ่อนสา,ส.ส. เขต (ร้อยเอ็ด เขต 6),http://202.6.26.16/images/candidate/thumb/45/6/5a8604da-eae5-4519-b3a5-c4304646cb6c.jpg,ทางเลือกใหม่,zone,ร้อยเอ็ด,6
นัฐวุฒิ ประทุมชุมภู,ส.ส. เขต (ร้อยเอ็ด เขต 7),http://202.6.26.16/images/candidate/thumb/45/7/5f19647a-976f-4280-b353-fd2508e80505.jpg,ทางเลือกใหม่,zone,ร้อยเอ็ด,7
อดิศักดิ์ โดงกูล,ส.ส. เขต (สมุทรปราการ เขต 1),http://202.6.26.16/images/candidate/thumb/11/1/da1af48a-e4f8-4baa-beea-1059ac66bda6.jpg,ทางเลือกใหม่,zone,สมุทรปราการ,1
ชลิต เหรียญทอง,ส.ส. เขต (สมุทรปราการ เขต 2),http://202.6.26.16/images/candidate/thumb/11/2/5bfa7b03-4f55-4093-b0a4-cea4ac74abd4.jpg,ทางเลือกใหม่,zone,สมุทรปราการ,2
มานพ ศรีระพันธ์,ส.ส. เขต (สมุทรปราการ เขต 3),http://202.6.26.16/images/candidate/thumb/11/3/44e82bca-997b-4ff7-854c-a4ae44294fb9.jpg,ทางเลือกใหม่,zone,สมุทรปราการ,3
สุรีรัตน์ แสนซิว,ส.ส. เขต (สมุทรปราการ เขต 6),http://202.6.26.16/images/candidate/thumb/11/6/fe0c402e-772b-4ca8-90cd-0a8a32d70a44.jpg,ทางเลือกใหม่,zone,สมุทรปราการ,6
วิมลรัตน์ บุญบำรุงศิลปหรรษา,ส.ส. เขต (สมุทรปราการ เขต 7),http://202.6.26.16/images/candidate/thumb/11/7/1a8ae058-6e11-4d61-bf42-ff62e2718f7b.jpg,ทางเลือกใหม่,zone,สมุทรปราการ,7
ทองยอด เสาะรส,ส.ส. เขต (สุรินทร์ เขต 1),http://202.6.26.16/images/candidate/thumb/32/1/40539102-4763-461e-b7d8-27a5522a5214.jpg,ทางเลือกใหม่,zone,สุรินทร์,1
ศรีแจ่มใส กุสสติ,ส.ส. เขต (สุรินทร์ เขต 2),http://202.6.26.16/images/candidate/thumb/32/2/e9497bef-64b9-497b-af44-5f6cd7f9470d.jpg,ทางเลือกใหม่,zone,สุรินทร์,2
บุญราญ สร้อยจิตร,ส.ส. เขต (สุรินทร์ เขต 3),http://202.6.26.16/images/candidate/thumb/32/3/df115937-b6ae-4d8e-97a7-571a72d30e42.jpg,ทางเลือกใหม่,zone,สุรินทร์,3
ลำใย ชาญศรี,ส.ส. เขต (สุรินทร์ เขต 4),http://202.6.26.16/images/candidate/thumb/32/4/07c6f0eb-1d6d-4d81-880b-899279582091.jpg,ทางเลือกใหม่,zone,สุรินทร์,4
สมจิต สอนกล้า,ส.ส. เขต (สุรินทร์ เขต 5),http://202.6.26.16/images/candidate/thumb/32/5/479ada19-c914-4e5f-b3c1-06c278e5dcb7.jpg,ทางเลือกใหม่,zone,สุรินทร์,5
อุราวรรณ์ หะวัน,ส.ส. เขต (สุรินทร์ เขต 6),http://202.6.26.16/images/candidate/thumb/32/6/bdd93ea9-b5c8-4a1f-8155-654760f0e510.jpg,ทางเลือกใหม่,zone,สุรินทร์,6
สมนึก อื้อเส่ง,ส.ส. เขต (สุรินทร์ เขต 7),http://202.6.26.16/images/candidate/thumb/32/7/63318a6b-5c44-4393-9625-f513b32f63bc.jpg,ทางเลือกใหม่,zone,สุรินทร์,7
พิมพา ขุนทองจันทร์,ส.ส. เขต (นครศรีธรรมราช เขต 1),http://202.6.26.16/images/candidate/thumb/80/1/517c1864-8597-4e13-a880-c491c3bdb207.jpg,ทางเลือกใหม่,zone,นครศรีธรรมราช,1
จันทร์เพ็ญ เกลี้ยงทอง,ส.ส. เขต (นครศรีธรรมราช เขต 2),http://202.6.26.16/images/candidate/thumb/80/2/0dae80d6-8b6c-4348-8cec-ec0e623f488d.jpg,ทางเลือกใหม่,zone,นครศรีธรรมราช,2
โชคชัย ลาชโรจน์,ส.ส. เขต (นครศรีธรรมราช เขต 5),http://202.6.26.16/images/candidate/thumb/80/5/2ceef652-8027-45b3-8335-937d0cd21a3a.jpg,ทางเลือกใหม่,zone,นครศรีธรรมราช,5
พีระพล วรรณรัตน์,ส.ส. เขต (นครศรีธรรมราช เขต 6),http://202.6.26.16/images/candidate/thumb/80/6/7446517f-2cbe-40a0-94b3-99d037f37a48.jpg,ทางเลือกใหม่,zone,นครศรีธรรมราช,6
กิติ์ดนัย ไชยนุรัตน์,ส.ส. เขต (นครศรีธรรมราช เขต 7),http://202.6.26.16/images/candidate/thumb/80/7/7e4e35cb-b490-446a-a372-906665b62f8b.jpg,ทางเลือกใหม่,zone,นครศรีธรรมราช,7
เตียง โนนทิง,ส.ส. เขต (บุรีรัมย์ เขต 4),http://202.6.26.16/images/candidate/thumb/31/4/974a94b7-1263-4dea-92f1-a1d17b5cbbf7.jpg,ทางเลือกใหม่,zone,บุรีรัมย์,4
สุพรรณ์ สมสวย,ส.ส. เขต (บุรีรัมย์ เขต 5),http://202.6.26.16/images/candidate/thumb/31/5/0bcd0ca4-d6f5-4787-8765-30aeb77220c5.jpg,ทางเลือกใหม่,zone,บุรีรัมย์,5
ภัทรพงศ์ สมสวย,ส.ส. เขต (บุรีรัมย์ เขต 6),http://202.6.26.16/images/candidate/thumb/31/6/3c66c845-860e-4be9-813d-53d270742bb7.jpg,ทางเลือกใหม่,zone,บุรีรัมย์,6
ปวรลักษณ์ ปริสัจจนันท์,ส.ส. เขต (ศรีสะเกษ เขต 1),http://202.6.26.16/images/candidate/thumb/33/1/ee66cbe9-8cf4-4543-82fb-eec046c9a808.jpg,ทางเลือกใหม่,zone,ศรีสะเกษ,1
วิจิตร จันทร์จิตร,ส.ส. เขต (ศรีสะเกษ เขต 2),http://202.6.26.16/images/candidate/thumb/33/2/68d7f6a4-e730-434f-9c3d-9854702f8550.jpg,ทางเลือกใหม่,zone,ศรีสะเกษ,2
แสงทรัพย์ สายสมบัติ,ส.ส. เขต (ศรีสะเกษ เขต 3),http://202.6.26.16/images/candidate/thumb/33/3/2a7ab023-d533-46d3-af49-99c557229ef6.jpg,ทางเลือกใหม่,zone,ศรีสะเกษ,3
ทรัพย์มงคล ชนะสงคราม,ส.ส. เขต (ศรีสะเกษ เขต 4),http://202.6.26.16/images/candidate/thumb/33/4/17b65101-543d-40f1-a4c8-460fb3cc0aaf.jpg,ทางเลือกใหม่,zone,ศรีสะเกษ,4
พลพล คชโคตร,ส.ส. เขต (ศรีสะเกษ เขต 5),http://202.6.26.16/images/candidate/thumb/33/5/dc6c7cf3-f168-434e-83ba-8416e32a51d3.jpg,ทางเลือกใหม่,zone,ศรีสะเกษ,5
ไสว ศรีมาศ,ส.ส. เขต (ศรีสะเกษ เขต 6),http://202.6.26.16/images/candidate/thumb/33/6/daf7e7ca-6842-45b6-80be-2a3b35131961.jpg,ทางเลือกใหม่,zone,ศรีสะเกษ,6
ชิตวัตน์ ยอดแก้ว,ส.ส. เขต (ศรีสะเกษ เขต 8),http://202.6.26.16/images/candidate/thumb/33/8/373da263-3390-425e-a6aa-02fdba7b5729.jpg,ทางเลือกใหม่,zone,ศรีสะเกษ,8
สุรเดช จินดาดำ,ส.ส. เขต (สงขลา เขต 2),http://202.6.26.16/images/candidate/thumb/90/2/ebe58db8-fda2-4be4-9b1c-5a3ffbc3fe86.jpg,ทางเลือกใหม่,zone,สงขลา,2
ธนภัทร แก้วสองสี,ส.ส. เขต (สงขลา เขต 3),http://202.6.26.16/images/candidate/thumb/90/3/79cf44c2-f284-4956-8270-3140eb6bd0b0.jpg,ทางเลือกใหม่,zone,สงขลา,3
วิโรจน์ นิลสุพรรณ,ส.ส. เขต (สงขลา เขต 4),http://202.6.26.16/images/candidate/thumb/90/4/66aa815f-08e5-4854-98f3-fc02addfb881.jpg,ทางเลือกใหม่,zone,สงขลา,4
สมหมาย ประเสริฐกุล,ส.ส. เขต (อุดรธานี เขต 2),http://202.6.26.16/images/candidate/thumb/41/2/25b23135-c48a-4e8e-b112-d4cc918b0ff2.jpg,ทางเลือกใหม่,zone,อุดรธานี,2
อาคม แฝงฤทธ์,ส.ส. เขต (อุดรธานี เขต 3),http://202.6.26.16/images/candidate/thumb/41/3/9db919a7-47ea-40b9-bd8f-c4ce40991073.jpg,ทางเลือกใหม่,zone,อุดรธานี,3
เกษม แก้วน้อย,ส.ส. เขต (ขอนแก่น เขต 5),http://202.6.26.16/images/candidate/thumb/40/5/391a7901-1626-4143-9fab-08c436a901b2.jpg,ทางเลือกใหม่,zone,ขอนแก่น,5
ประกาย ศรีโยธา,ส.ส. เขต (ขอนแก่น เขต 6),http://202.6.26.16/images/candidate/thumb/40/6/5e934be7-938d-4321-acce-937218c30ab3.jpg,ทางเลือกใหม่,zone,ขอนแก่น,6
ศิริ ประพรต,ส.ส. เขต (ขอนแก่น เขต 7),http://202.6.26.16/images/candidate/thumb/40/7/3f8e164f-ddd7-4e41-bb28-f29aaa650be9.jpg,ทางเลือกใหม่,zone,ขอนแก่น,7
