name,desc,image,PartyName,memberType,province_name,zone_number
ธนานุพงษ์ มีมา,ส.ส. เขต (นครนายก เขต 1),http://202.6.26.16/images/candidate/thumb/26/1/09a4965a-9a25-4df8-b778-bec093249f53.jpg,พลเมืองไทย,zone,นครนายก,1
สุเทพ เจริญจวง,ส.ส. เขต (สมุทรสงคราม เขต 1),http://202.6.26.16/images/candidate/thumb/75/1/709d12b6-536d-4eb0-a980-6d3cfb3e7605.jpg,พลเมืองไทย,zone,สมุทรสงคราม,1
ประสาน วงเวียน,ส.ส. เขต (ชัยนาท เขต 1),http://202.6.26.16/images/candidate/thumb/18/1/0c28df09-8f81-4322-a83a-b5c6a8ab3922.jpg,พลเมืองไทย,zone,ชัยนาท,1
พิษณุ วงเวียน,ส.ส. เขต (ชัยนาท เขต 2),http://202.6.26.16/images/candidate/thumb/18/2/e0c211a7-108a-428e-87e8-54466795e60d.jpg,พลเมืองไทย,zone,ชัยนาท,2
อรุณ วัดโสภา,ส.ส. เขต (บึงกาฬ เขต 1),http://202.6.26.16/images/candidate/thumb/38/1/635ac21d-e1fe-4394-bf9e-b9f6941b711c.jpg,พลเมืองไทย,zone,บึงกาฬ,1
สาวิตรี พลภักดี,ส.ส. เขต (บึงกาฬ เขต 2),http://202.6.26.16/images/candidate/thumb/38/2/0b31a70a-7f48-45a3-a85f-c46cf10c7abe.jpg,พลเมืองไทย,zone,บึงกาฬ,2
อัษฎาวุธ นพเคราะห์,ส.ส. เขต (มุกดาหาร เขต 1),http://202.6.26.16/images/candidate/thumb/49/1/a8a23313-f676-4d8e-be1e-b05d7e99cce4.jpg,พลเมืองไทย,zone,มุกดาหาร,1
ธนพงศ์ อุระ,ส.ส. เขต (มุกดาหาร เขต 2),http://202.6.26.16/images/candidate/thumb/49/2/0d6476d6-e1ac-4004-a7f7-408d26328ddd.jpg,พลเมืองไทย,zone,มุกดาหาร,2
สนิท จันทร์โสด,ส.ส. เขต (สตูล เขต 1),http://202.6.26.16/images/candidate/thumb/91/1/382a7942-6f26-439b-8902-37406f932791.jpg,พลเมืองไทย,zone,สตูล,1
นิคม แก้วทอง,ส.ส. เขต (สตูล เขต 2),http://202.6.26.16/images/candidate/thumb/91/2/19ba5aa5-9a0a-47e5-bda4-d40f2ecbf9b6.jpg,พลเมืองไทย,zone,สตูล,2
อนันต์ เข็มทอง,ส.ส. เขต (อุทัยธานี เขต 1),http://202.6.26.16/images/candidate/thumb/61/1/eb52cc03-5b13-4a03-9110-0416037cf8b5.jpg,พลเมืองไทย,zone,อุทัยธานี,1
ชัยรินทร์ อิศรางกูร ณ อยุธยา,ส.ส. เขต (อุทัยธานี เขต 2),http://202.6.26.16/images/candidate/thumb/61/2/aa96673b-ba48-4455-9d4b-519d805d152e.jpg,พลเมืองไทย,zone,อุทัยธานี,2
สันติ พลอยล้อมเพชร,ส.ส. เขต (จันทบุรี เขต 1),http://202.6.26.16/images/candidate/thumb/22/1/f11fa951-0ea5-4150-9fe0-b4dd8a273881.jpg,พลเมืองไทย,zone,จันทบุรี,1
นัยนา สุวรรณวิธี,ส.ส. เขต (ชุมพร เขต 2),http://202.6.26.16/images/candidate/thumb/86/2/622c253d-cff0-4daa-910c-4448c2d21932.jpg,พลเมืองไทย,zone,ชุมพร,2
มนุเชษฐ์ ดำนาค,ส.ส. เขต (ชุมพร เขต 3),http://202.6.26.16/images/candidate/thumb/86/3/3d93d1de-1eb4-4f96-ba92-8b6ca1b3d001.jpg,พลเมืองไทย,zone,ชุมพร,3
ประเทือง ศรีคง,ส.ส. เขต (ตรัง เขต 1),http://202.6.26.16/images/candidate/thumb/92/1/c233abc5-e128-4685-b971-48bd72f99730.jpg,พลเมืองไทย,zone,ตรัง,1
จินตณัฐ สุวรรณหมัด,ส.ส. เขต (ตรัง เขต 2),http://202.6.26.16/images/candidate/thumb/92/2/9d1385a5-90cb-41d3-948a-9e8788ae6276.jpg,พลเมืองไทย,zone,ตรัง,2
ศุภฤกษ์ กาวินำ,ส.ส. เขต (ตาก เขต 2),http://202.6.26.16/images/candidate/thumb/63/2/31358059-5e7e-472c-9f36-aaf5757d3360.jpg,พลเมืองไทย,zone,ตาก,2
มนูญ สุขวรรณ,ส.ส. เขต (ตาก เขต 3),http://202.6.26.16/images/candidate/thumb/63/3/e84d4c2f-d386-415c-8656-f9fe9bf82fdd.jpg,พลเมืองไทย,zone,ตาก,3
เสริมพงษ์ ลิบลับ,ส.ส. เขต (ประจวบคีรีขันธ์ เขต 1),http://202.6.26.16/images/candidate/thumb/77/1/e9755aca-d54f-4316-b049-83009c5159ac.jpg,พลเมืองไทย,zone,ประจวบคีรีขันธ์,1
ธมน โพธิ์งาม,ส.ส. เขต (ประจวบคีรีขันธ์ เขต 2),http://202.6.26.16/images/candidate/thumb/77/2/fcc11a35-9b38-44d4-9f96-0ecc7e43baff.jpg,พลเมืองไทย,zone,ประจวบคีรีขันธ์,2
นรินทร์ บ้วนฮวด,ส.ส. เขต (ประจวบคีรีขันธ์ เขต 3),http://202.6.26.16/images/candidate/thumb/77/3/64f54ea9-72c6-4e10-b20f-6ee5a83c3901.jpg,พลเมืองไทย,zone,ประจวบคีรีขันธ์,3
ภาณุพันธ์ น้าวิลัยเจริญ,ส.ส. เขต (ปราจีนบุรี เขต 1),http://202.6.26.16/images/candidate/thumb/25/1/a08f7966-4a20-470e-9fc3-b9408927dad9.jpg,พลเมืองไทย,zone,ปราจีนบุรี,1
วิถี อินทร์คำ,ส.ส. เขต (ปราจีนบุรี เขต 2),http://202.6.26.16/images/candidate/thumb/25/2/3de0674c-0b79-4ce2-9b12-3fb55fb1060d.jpg,พลเมืองไทย,zone,ปราจีนบุรี,2
ปัญญา กองชุมพล,ส.ส. เขต (ปราจีนบุรี เขต 3),http://202.6.26.16/images/candidate/thumb/25/3/0d3831b2-b0dd-486f-8614-102664b61cbf.jpg,พลเมืองไทย,zone,ปราจีนบุรี,3
มนตรี สังฆานาคินทร์,ส.ส. เขต (พัทลุง เขต 1),http://202.6.26.16/images/candidate/thumb/93/1/234ec25c-91fe-4253-aa76-90b7beff1b60.jpg,พลเมืองไทย,zone,พัทลุง,1
สัญญพงศ์ ภู่ประดิษฐศิลป์,ส.ส. เขต (พัทลุง เขต 3),http://202.6.26.16/images/candidate/thumb/93/3/6cfdc41f-e505-43b7-8385-0f418bd607b1.jpg,พลเมืองไทย,zone,พัทลุง,3
เสริมส่ง อินทร์ประสิทธิ์,ส.ส. เขต (เพชรบุรี เขต 2),http://202.6.26.16/images/candidate/thumb/76/2/d0567c8c-d4c3-4b3d-86f5-fcbdffdc665b.jpg,พลเมืองไทย,zone,เพชรบุรี,2
สุชีลา วิริยะภิญโญชีพ,ส.ส. เขต (เพชรบุรี เขต 3),http://202.6.26.16/images/candidate/thumb/76/3/46e68523-9b5c-48b1-a0df-383d8efe5c76.jpg,พลเมืองไทย,zone,เพชรบุรี,3
สถิตย์ ชูเมือง,ส.ส. เขต (ยะลา เขต 1),http://202.6.26.16/images/candidate/thumb/95/1/29907081-3621-40f7-bc48-87d94cc7a17e.jpg,พลเมืองไทย,zone,ยะลา,1
อับดุลกอเดร์ มาซอรี,ส.ส. เขต (ยะลา เขต 2),http://202.6.26.16/images/candidate/thumb/95/2/21c2d24d-fb09-4880-9c89-762baa9840f4.jpg,พลเมืองไทย,zone,ยะลา,2
พิทยา คำภูอ่อน,ส.ส. เขต (เลย เขต 1),http://202.6.26.16/images/candidate/thumb/42/1/fc9b29e7-bd91-40a1-aae3-73edb57b2c6e.jpg,พลเมืองไทย,zone,เลย,1
พีระศักดิ์ สารวงษ์,ส.ส. เขต (เลย เขต 2),http://202.6.26.16/images/candidate/thumb/42/2/1686fa49-d0cb-4e3d-a0b4-d9dfb768d810.jpg,พลเมืองไทย,zone,เลย,2
ประพัฒน์พงศ์ สืบสาย,ส.ส. เขต (เลย เขต 3),http://202.6.26.16/images/candidate/thumb/42/3/46ba527e-69a8-45f3-ac74-a4ec5d3eb6c9.jpg,พลเมืองไทย,zone,เลย,3
ณัทณิชชา ปรีณาภานนท์,ส.ส. เขต (สมุทรสาคร เขต 1),http://202.6.26.16/images/candidate/thumb/74/1/ecbe6cd5-5a85-4a60-9540-829560222325.jpg,พลเมืองไทย,zone,สมุทรสาคร,1
สรยุทธ ปลื้มถนอม,ส.ส. เขต (สมุทรสาคร เขต 2),http://202.6.26.16/images/candidate/thumb/74/2/9773a484-5ace-4c40-addd-1444da1be0a4.jpg,พลเมืองไทย,zone,สมุทรสาคร,2
บุญเลื่อน คงเพ็ชร,ส.ส. เขต (สมุทรสาคร เขต 3),http://202.6.26.16/images/candidate/thumb/74/3/107333eb-d052-4d09-8cc4-5d09160f2862.jpg,พลเมืองไทย,zone,สมุทรสาคร,3
สมัย ศรีสมาน,ส.ส. เขต (สระแก้ว เขต 3),http://202.6.26.16/images/candidate/thumb/27/3/e36380fa-c915-4648-bbfd-2b44df10dc25.jpg,พลเมืองไทย,zone,สระแก้ว,3
พรชัย แสงสว่าง,ส.ส. เขต (สุโขทัย เขต 2),http://202.6.26.16/images/candidate/thumb/64/2/77a84cd2-667a-4116-97dd-2f203f262947.jpg,พลเมืองไทย,zone,สุโขทัย,2
ประสิทธิภาพ หนูวารี,ส.ส. เขต (หนองคาย เขต 1),http://202.6.26.16/images/candidate/thumb/43/1/2deccad1-4cfd-41ef-8e35-4bc66fcc613c.jpg,พลเมืองไทย,zone,หนองคาย,1
ศักดิ์ บึงลี,ส.ส. เขต (หนองคาย เขต 2),http://202.6.26.16/images/candidate/thumb/43/2/f53280fb-1fea-4d9e-98c8-b6c1a3aed475.jpg,พลเมืองไทย,zone,หนองคาย,2
สฤษดิ์ ไชยเดช,ส.ส. เขต (หนองคาย เขต 3),http://202.6.26.16/images/candidate/thumb/43/3/68cb597b-dd18-4b26-9156-b779686c0f0a.jpg,พลเมืองไทย,zone,หนองคาย,3
วิษณุ พุทธรักษามณี,ส.ส. เขต (กำแพงเพชร เขต 1),http://202.6.26.16/images/candidate/thumb/62/1/c8d18b6d-ba0f-47bb-a97d-4734c176b438.jpg,พลเมืองไทย,zone,กำแพงเพชร,1
เชาวลิต คงแสงชัย,ส.ส. เขต (ฉะเชิงเทรา เขต 2),http://202.6.26.16/images/candidate/thumb/24/2/d1af7ef9-ff08-4ef0-8b8a-bd61f19ad420.jpg,พลเมืองไทย,zone,ฉะเชิงเทรา,2
ธนกฤต ทองดี,ส.ส. เขต (ฉะเชิงเทรา เขต 3),http://202.6.26.16/images/candidate/thumb/24/3/243e4976-ce0a-42fb-9b60-235a668cfe9e.jpg,พลเมืองไทย,zone,ฉะเชิงเทรา,3
ณรงค์ฤทธิ์ โคจำนงค์,ส.ส. เขต (นครพนม เขต 1),http://202.6.26.16/images/candidate/thumb/48/1/1696b21e-1049-4193-bb1e-665f88bc44b3.jpg,พลเมืองไทย,zone,นครพนม,1
เผด็จ อามาตย์สมบัติ,ส.ส. เขต (นครพนม เขต 2),http://202.6.26.16/images/candidate/thumb/48/2/84062158-5bb9-491e-b0d1-f3bccc4f6c7c.jpg,พลเมืองไทย,zone,นครพนม,2
สุวิบูลย์ เตโชจิรพัฒน์,ส.ส. เขต (นครพนม เขต 3),http://202.6.26.16/images/candidate/thumb/48/3/033e7b91-0262-40bb-8df3-8017eb5b52ff.jpg,พลเมืองไทย,zone,นครพนม,3
ปราณี ยะสะกะ,ส.ส. เขต (นครพนม เขต 4),http://202.6.26.16/images/candidate/thumb/48/4/06628f44-f423-4581-adcd-0ebdf65c00ac.jpg,พลเมืองไทย,zone,นครพนม,4
จเรศักดิ์ เหลือมปุ๋ย,ส.ส. เขต (นราธิวาส เขต 1),http://202.6.26.16/images/candidate/thumb/96/1/c883adb6-3954-4a32-825f-f43c2a407f49.jpg,พลเมืองไทย,zone,นราธิวาส,1
บันลือ รัตนสกุล,ส.ส. เขต (นราธิวาส เขต 2),http://202.6.26.16/images/candidate/thumb/96/2/db070a01-079a-4533-a89a-e8dd47ab49b2.jpg,พลเมืองไทย,zone,นราธิวาส,2
วินัย ผดุงมาตร,ส.ส. เขต (นราธิวาส เขต 3),http://202.6.26.16/images/candidate/thumb/96/3/ac7a80e1-354b-4a1f-9ec5-f2dd0030f586.jpg,พลเมืองไทย,zone,นราธิวาส,3
นิติมา นิเลาะ,ส.ส. เขต (นราธิวาส เขต 4),http://202.6.26.16/images/candidate/thumb/96/4/58f38f6d-c935-4fe3-b4cc-9233ff644796.jpg,พลเมืองไทย,zone,นราธิวาส,4
มุสตอปา สะแม,ส.ส. เขต (ปัตตานี เขต 1),http://202.6.26.16/images/candidate/thumb/94/1/f4904109-217a-45c2-932e-cefbe75974c9.jpg,พลเมืองไทย,zone,ปัตตานี,1
มูฮำมัด อาแว,ส.ส. เขต (ปัตตานี เขต 3),http://202.6.26.16/images/candidate/thumb/94/3/728e3fc2-c723-40fb-ac5e-2a13213624f8.jpg,พลเมืองไทย,zone,ปัตตานี,3
ตอยบัส ยาซิง,ส.ส. เขต (ปัตตานี เขต 4),http://202.6.26.16/images/candidate/thumb/94/4/f7a1730b-873c-4853-b1fd-56592c5367c3.jpg,พลเมืองไทย,zone,ปัตตานี,4
เสน่ห์ จันทร์สุภา,ส.ส. เขต (พระนครศรีอยุธยา เขต 2),http://202.6.26.16/images/candidate/thumb/14/2/5f7eba16-5246-455e-9a67-070a5f0958bf.jpg,พลเมืองไทย,zone,พระนครศรีอยุธยา,2
อาทิตย์ ลิมป์สภาพกสิผล,ส.ส. เขต (ระยอง เขต 1),http://202.6.26.16/images/candidate/thumb/21/1/028a393a-a813-4abf-a6b0-b340cb4f9a0b.jpg,พลเมืองไทย,zone,ระยอง,1
มนตรี ตันเงิน,ส.ส. เขต (ระยอง เขต 2),http://202.6.26.16/images/candidate/thumb/21/2/5f3609a7-1283-4cf3-9dee-4bb89fe4f623.jpg,พลเมืองไทย,zone,ระยอง,2
วัฒนา พวงสวัสดิ์,ส.ส. เขต (ระยอง เขต 3),http://202.6.26.16/images/candidate/thumb/21/3/2c95cbd2-eef7-455a-b6ac-fd4058e7c410.jpg,พลเมืองไทย,zone,ระยอง,3
ธรณ์พัฒน์ รัตนานุสรณ์,ส.ส. เขต (ระยอง เขต 4),http://202.6.26.16/images/candidate/thumb/21/4/f2100a75-b241-44bd-8893-74fe8f04a5de.jpg,พลเมืองไทย,zone,ระยอง,4
อภิชาติ โชว์เจริญสุข,ส.ส. เขต (ลำปาง เขต 1),http://202.6.26.16/images/candidate/thumb/52/1/54ae8396-71c0-43f0-94c5-6c4fbb2f5161.jpg,พลเมืองไทย,zone,ลำปาง,1
อนันต์ แสนจิตต์,ส.ส. เขต (ลำปาง เขต 3),http://202.6.26.16/images/candidate/thumb/52/3/702da665-ece2-4394-9342-cd786da9a8c7.jpg,พลเมืองไทย,zone,ลำปาง,3
พิสุทธิศักดิ์ ภาใจเฟือย,ส.ส. เขต (กาญจนบุรี เขต 2),http://202.6.26.16/images/candidate/thumb/71/2/1fe1d016-0de3-4112-9d81-50a6a5012ae0.jpg,พลเมืองไทย,zone,กาญจนบุรี,2
สง่า สีทำมา,ส.ส. เขต (กาฬสินธุ์ เขต 2),http://202.6.26.16/images/candidate/thumb/46/2/63a236a5-13a5-484e-ab1b-5d5fb3534af8.jpg,พลเมืองไทย,zone,กาฬสินธุ์,2
อิษรา สีทำมา,ส.ส. เขต (กาฬสินธุ์ เขต 3),http://202.6.26.16/images/candidate/thumb/46/3/2b5dd287-9a82-4d45-9e86-682b2322edb9.jpg,พลเมืองไทย,zone,กาฬสินธุ์,3
จวน นัทยาย,ส.ส. เขต (กาฬสินธุ์ เขต 4),http://202.6.26.16/images/candidate/thumb/46/4/02673d06-b008-4c47-97d9-7fd77309c992.jpg,พลเมืองไทย,zone,กาฬสินธุ์,4
ณัฐปภัสร์ ประกายบุษราคัม,ส.ส. เขต (นครปฐม เขต 2),http://202.6.26.16/images/candidate/thumb/73/2/6b9723be-ab37-4556-8ff8-1ea554e83b93.jpg,พลเมืองไทย,zone,นครปฐม,2
พิชญ์สิณี ภักดีศิริลำดวน,ส.ส. เขต (นครปฐม เขต 5),http://202.6.26.16/images/candidate/thumb/73/5/68841d35-6773-487c-8e03-f49d99b34e2a.jpg,พลเมืองไทย,zone,นครปฐม,5
วีระพงษ์ แต่งเนตร,ส.ส. เขต (พิษณุโลก เขต 1),http://202.6.26.16/images/candidate/thumb/65/1/62059f41-ae99-41d5-a436-e5c7472720ae.jpg,พลเมืองไทย,zone,พิษณุโลก,1
บรรเจิด เมืองเขียว,ส.ส. เขต (พิษณุโลก เขต 2),http://202.6.26.16/images/candidate/thumb/65/2/c388e28c-9656-4871-9ab1-b71719f905fa.jpg,พลเมืองไทย,zone,พิษณุโลก,2
อภิชาต มนัสตรง,ส.ส. เขต (พิษณุโลก เขต 3),http://202.6.26.16/images/candidate/thumb/65/3/bf322a06-fbbf-4a39-b625-0cfe81162a19.jpg,พลเมืองไทย,zone,พิษณุโลก,3
วรชัย กาญจนะโกสุม,ส.ส. เขต (พิษณุโลก เขต 5),http://202.6.26.16/images/candidate/thumb/65/5/01a29608-83c3-4ac4-b958-59d2b5cfbf1e.jpg,พลเมืองไทย,zone,พิษณุโลก,5
สมบูรณ์ เครื่องทิพย์,ส.ส. เขต (เพชรบูรณ์ เขต 3),http://202.6.26.16/images/candidate/thumb/67/3/79216152-dc5b-46f7-9839-c9db9c1b0c00.jpg,พลเมืองไทย,zone,เพชรบูรณ์,3
ประดิษฐ์ บุญยอด,ส.ส. เขต (เพชรบูรณ์ เขต 4),http://202.6.26.16/images/candidate/thumb/67/4/5122d9b8-171d-440d-9dec-ae8fe4a991dd.jpg,พลเมืองไทย,zone,เพชรบูรณ์,4
วินิจ สัตตะบุตร,ส.ส. เขต (เพชรบูรณ์ เขต 5),http://202.6.26.16/images/candidate/thumb/67/5/2b9073e1-f231-47cd-ae40-0c83798033a5.jpg,พลเมืองไทย,zone,เพชรบูรณ์,5
กานจ์ กงเพชร,ส.ส. เขต (มหาสารคาม เขต 1),http://202.6.26.16/images/candidate/thumb/44/1/f817790a-d272-4984-afc2-e1cf2517a95f.jpg,พลเมืองไทย,zone,มหาสารคาม,1
สมเพชร ปาปะโข,ส.ส. เขต (มหาสารคาม เขต 2),http://202.6.26.16/images/candidate/thumb/44/2/ec4a4a7b-9b6d-49b6-a8b7-f52131c30799.jpg,พลเมืองไทย,zone,มหาสารคาม,2
อังคณา วงษ์นอก,ส.ส. เขต (มหาสารคาม เขต 3),http://202.6.26.16/images/candidate/thumb/44/3/19d417cc-2ef1-41c5-a45c-a700a0094794.jpg,พลเมืองไทย,zone,มหาสารคาม,3
ประภาส เนื่องแก้ว,ส.ส. เขต (มหาสารคาม เขต 4),http://202.6.26.16/images/candidate/thumb/44/4/9314c817-2095-4b5d-9400-0915bde1328e.jpg,พลเมืองไทย,zone,มหาสารคาม,4
ธนวัฒน์ สิมลา,ส.ส. เขต (มหาสารคาม เขต 5),http://202.6.26.16/images/candidate/thumb/44/5/0b842529-24a7-4cda-8272-93f4a1c457ab.jpg,พลเมืองไทย,zone,มหาสารคาม,5
สุรศักดิ์ จงมโนประเสริฐ,ส.ส. เขต (ราชบุรี เขต 5),http://202.6.26.16/images/candidate/thumb/70/5/95d27125-cb0a-407b-b98f-435194755a49.jpg,พลเมืองไทย,zone,ราชบุรี,5
มงคล พรมเดื่อ,ส.ส. เขต (ชัยภูมิ เขต 4),http://202.6.26.16/images/candidate/thumb/36/4/8f74c1ce-0f5e-4d68-bd3a-e38b8fb7e195.jpg,พลเมืองไทย,zone,ชัยภูมิ,4
เศรษฐพงศ์ สุวรรณบน,ส.ส. เขต (ชัยภูมิ เขต 5),http://202.6.26.16/images/candidate/thumb/36/5/45798f15-c9ae-4f30-8614-107866fb8883.jpg,พลเมืองไทย,zone,ชัยภูมิ,5
ณรงค์ศักดิ์ มณี,ส.ส. เขต (นครสวรรค์ เขต 2),http://202.6.26.16/images/candidate/thumb/60/2/f164926d-74aa-48e8-83fc-da39966bbf9c.jpg,พลเมืองไทย,zone,นครสวรรค์,2
พิชัย วิบูลย์วัฒนกุล,ส.ส. เขต (นครสวรรค์ เขต 3),http://202.6.26.16/images/candidate/thumb/60/3/010f8ccf-2715-4aa6-be91-f40889719c20.jpg,พลเมืองไทย,zone,นครสวรรค์,3
ฉัตรชัย ดิษเจริญ,ส.ส. เขต (นครสวรรค์ เขต 6),http://202.6.26.16/images/candidate/thumb/60/6/9077620f-59e5-4771-93da-31ba1f674b82.jpg,พลเมืองไทย,zone,นครสวรรค์,6
กิตติ โสภณสังฆกิจ,ส.ส. เขต (นนทบุรี เขต 2),http://202.6.26.16/images/candidate/thumb/12/2/1557171d-d025-4e97-9e8e-85a0e5f5c9d8.jpg,พลเมืองไทย,zone,นนทบุรี,2
อิทธิพล คงพสิษฐ์พร,ส.ส. เขต (นนทบุรี เขต 3),http://202.6.26.16/images/candidate/thumb/12/3/75920463-7851-4ea1-b01a-3c06d71ba9ec.jpg,พลเมืองไทย,zone,นนทบุรี,3
ศภัคชคง สมบูรณ์สุข,ส.ส. เขต (นนทบุรี เขต 4),http://202.6.26.16/images/candidate/thumb/12/4/562d033f-2684-4e7d-a9c8-c304c9145069.jpg,พลเมืองไทย,zone,นนทบุรี,4
ไพจิตร จันทรโชติ,ส.ส. เขต (นนทบุรี เขต 5),http://202.6.26.16/images/candidate/thumb/12/5/671b20bf-82ec-4045-bfc0-2635b207a3c2.jpg,พลเมืองไทย,zone,นนทบุรี,5
พิชาภพ เสียงทอง,ส.ส. เขต (ปทุมธานี เขต 1),http://202.6.26.16/images/candidate/thumb/13/1/ce781c55-f7e2-4e56-89d7-04f942bf71d6.jpg,พลเมืองไทย,zone,ปทุมธานี,1
สุทิน บุญญบาล,ส.ส. เขต (ปทุมธานี เขต 2),http://202.6.26.16/images/candidate/thumb/13/2/79262df5-5f7f-4288-bcd3-2ec444de8948.jpg,พลเมืองไทย,zone,ปทุมธานี,2
ชัยพร จันทนา,ส.ส. เขต (ปทุมธานี เขต 3),http://202.6.26.16/images/candidate/thumb/13/3/969e80c2-c35c-4891-bf37-cf404a63b0e4.jpg,พลเมืองไทย,zone,ปทุมธานี,3
สรศักดิ์ เชื้อไทย,ส.ส. เขต (ปทุมธานี เขต 5),http://202.6.26.16/images/candidate/thumb/13/5/23405d9a-4189-4bf6-9168-6a261bf2907f.jpg,พลเมืองไทย,zone,ปทุมธานี,5
พัทธนันท์ อธิภูชนะชัย,ส.ส. เขต (สกลนคร เขต 1),http://202.6.26.16/images/candidate/thumb/47/1/f1c24110-f080-43fe-af2b-f98726bbc02b.jpg,พลเมืองไทย,zone,สกลนคร,1
หมื่นศักดิ์ อินธิแสง,ส.ส. เขต (สกลนคร เขต 2),http://202.6.26.16/images/candidate/thumb/47/2/4c7c3501-035c-40ae-9cbd-654cf4ccc0b1.jpg,พลเมืองไทย,zone,สกลนคร,2
วิชิต โคตรแก้ว,ส.ส. เขต (สกลนคร เขต 3),http://202.6.26.16/images/candidate/thumb/47/3/af836f58-f2be-47f3-99ed-d434015823ba.jpg,พลเมืองไทย,zone,สกลนคร,3
สุคนธ์ทิพย์ เพิ่มพูล,ส.ส. เขต (สกลนคร เขต 4),http://202.6.26.16/images/candidate/thumb/47/4/7f98574e-b6c9-494a-8cb7-b6d41058a096.jpg,พลเมืองไทย,zone,สกลนคร,4
บุญมี ป้อพระลัพ,ส.ส. เขต (สกลนคร เขต 5),http://202.6.26.16/images/candidate/thumb/47/5/cf0a27c2-6bd7-4570-9465-fa46b1319413.jpg,พลเมืองไทย,zone,สกลนคร,5
นัฐฐานันท์ ดวงมาลย์,ส.ส. เขต (สกลนคร เขต 6),http://202.6.26.16/images/candidate/thumb/47/6/5c985d79-2196-4dfe-bc1b-664d911a4af5.jpg,พลเมืองไทย,zone,สกลนคร,6
อนิรุจน์ คงทรัพย์,ส.ส. เขต (สุราษฎร์ธานี เขต 3),http://202.6.26.16/images/candidate/thumb/84/3/d4adffd6-add4-4072-93be-3a5ccb7c25c3.jpg,พลเมืองไทย,zone,สุราษฎร์ธานี,3
